[
  {
    "id": "co-francais-ecrit",
    "label": "Français — écrit",
    "bloc": "anticipee",
    "coefficient": 5,
    "domaine": "lettres",
    "quand": "Juin 2026, en fin de première",
    "portee": "commun",
    "comment": "Commentaire de texte ou dissertation, en 4 h. La note est déjà connue.",
    "order": 1,
    "sources": ["s-calcul-note", "s-presentation-bac"]
  },
  {
    "id": "co-francais-oral",
    "label": "Français — oral",
    "bloc": "anticipee",
    "coefficient": 5,
    "domaine": "lettres",
    "quand": "Juin 2026, en fin de première",
    "portee": "commun",
    "comment": "Explication d'un texte du descriptif, puis entretien sur une œuvre choisie.",
    "order": 2,
    "sources": ["s-calcul-note", "s-presentation-bac"]
  },
  {
    "id": "co-maths-anticipee",
    "label": "Mathématiques — épreuve anticipée",
    "bloc": "anticipee",
    "coefficient": 2,
    "domaine": "sciences",
    "quand": "Juin 2026, en fin de première",
    "portee": "commun",
    "comment": "Nouvelle épreuve, passée pour la première fois en juin 2026 par tous les élèves de première.",
    "order": 3,
    "sources": ["s-eam", "s-eam-bo", "s-calcul-note"]
  },
  {
    "id": "co-specialite-maths",
    "label": "Spécialité mathématiques",
    "bloc": "terminale",
    "coefficient": 16,
    "domaine": "sciences",
    "quand": "Juin 2027",
    "portee": "profil",
    "profilNote": "L'une des deux spécialités gardées en terminale (ici en exemple).",
    "comment": "Avec l'autre spécialité, c'est le plus gros bloc du bac : 32 coefficients sur 104.",
    "order": 4,
    "sources": ["s-calcul-note", "s-spe-maths"]
  },
  {
    "id": "co-specialite-physique-chimie",
    "label": "Spécialité physique-chimie",
    "bloc": "terminale",
    "coefficient": 16,
    "domaine": "sciences",
    "quand": "Juin 2027",
    "portee": "profil",
    "profilNote": "L'autre spécialité gardée en terminale (ici en exemple).",
    "comment": "Une épreuve en deux parties : un écrit et une partie pratique, en salle de TP.",
    "order": 5,
    "sources": ["s-calcul-note", "s-spe-physique-chimie"]
  },
  {
    "id": "co-philosophie",
    "label": "Philosophie",
    "bloc": "terminale",
    "coefficient": 8,
    "domaine": "lettres",
    "quand": "Juin 2027",
    "portee": "commun",
    "comment": "Épreuve écrite commune à tous les élèves de la voie générale.",
    "order": 6,
    "sources": ["s-calcul-note", "s-presentation-bac"]
  },
  {
    "id": "co-grand-oral",
    "label": "Grand oral",
    "bloc": "terminale",
    "coefficient": 8,
    "domaine": "grand-oral",
    "quand": "Juin 2027",
    "portee": "commun",
    "comment": "Coefficient 10 jusqu'à la session 2026 ; il passe à 8 en 2027, l'épreuve anticipée de maths ayant pris les 2 points d'écart.",
    "order": 7,
    "sources": ["s-calcul-note", "s-grand-oral"]
  },
  {
    "id": "co-specialite-abandonnee",
    "label": "Spécialité abandonnée en fin de première",
    "bloc": "continu",
    "coefficient": 8,
    "repartition": [{ "annee": "premiere", "part": 8 }],
    "domaine": "sciences",
    "quand": "Moyenne de l'année de première",
    "portee": "commun",
    "profilNote": "Exemple : SVT. La moyenne de première est connue dès la fin de l'année.",
    "comment": "La plus grosse note de contrôle continu, et la seule qui ne dépende que de l'année de première.",
    "order": 8,
    "sources": ["s-controle-continu", "s-calcul-note"]
  },
  {
    "id": "co-histoire-geographie",
    "label": "Histoire-géographie",
    "bloc": "continu",
    "coefficient": 6,
    "repartition": [
      { "annee": "premiere", "part": 3 },
      { "annee": "terminale", "part": 3 }
    ],
    "domaine": "humanites",
    "quand": "Moyennes de première et de terminale",
    "portee": "commun",
    "order": 9,
    "sources": ["s-controle-continu", "s-calcul-note"]
  },
  {
    "id": "co-lva",
    "label": "Langue vivante A",
    "bloc": "continu",
    "coefficient": 6,
    "repartition": [
      { "annee": "premiere", "part": 3 },
      { "annee": "terminale", "part": 3 }
    ],
    "domaine": "langues",
    "quand": "Moyennes de première et de terminale",
    "portee": "commun",
    "profilNote": "Exemple : anglais.",
    "order": 10,
    "sources": ["s-controle-continu", "s-calcul-note"]
  },
  {
    "id": "co-lvb",
    "label": "Langue vivante B",
    "bloc": "continu",
    "coefficient": 6,
    "repartition": [
      { "annee": "premiere", "part": 3 },
      { "annee": "terminale", "part": 3 }
    ],
    "domaine": "langues",
    "quand": "Moyennes de première et de terminale",
    "portee": "commun",
    "profilNote": "Exemple : italien.",
    "order": 11,
    "sources": ["s-controle-continu", "s-calcul-note"]
  },
  {
    "id": "co-enseignement-scientifique",
    "label": "Enseignement scientifique",
    "bloc": "continu",
    "coefficient": 6,
    "repartition": [
      { "annee": "premiere", "part": 3 },
      { "annee": "terminale", "part": 3 }
    ],
    "domaine": "sciences",
    "quand": "Moyennes de première et de terminale",
    "portee": "commun",
    "comment": "Le tronc commun scientifique, distinct des spécialités.",
    "order": 12,
    "sources": ["s-controle-continu", "s-calcul-note"]
  },
  {
    "id": "co-eps",
    "label": "Éducation physique et sportive",
    "bloc": "continu",
    "coefficient": 6,
    "repartition": [{ "annee": "terminale", "part": 6 }],
    "domaine": "eps-arts",
    "quand": "Terminale, sur trois épreuves dans l'année",
    "portee": "commun",
    "comment": "Trois épreuves passées au lycée, dans trois activités différentes, notées par les professeurs.",
    "order": 13,
    "sources": ["s-eps", "s-controle-continu"]
  },
  {
    "id": "co-emc",
    "label": "Enseignement moral et civique",
    "bloc": "continu",
    "coefficient": 2,
    "repartition": [
      { "annee": "premiere", "part": 1 },
      { "annee": "terminale", "part": 1 }
    ],
    "domaine": "humanites",
    "quand": "Moyennes de première et de terminale",
    "portee": "commun",
    "order": 14,
    "sources": ["s-controle-continu", "s-calcul-note"]
  },
  {
    "id": "co-option-maths-expertes",
    "label": "Option mathématiques expertes",
    "bloc": "option",
    "coefficient": 2,
    "repartition": [{ "annee": "terminale", "part": 2 }],
    "domaine": "sciences",
    "quand": "Moyenne de terminale",
    "portee": "profil",
    "profilNote": "Option réservée aux élèves qui gardent la spécialité maths ; elle ne se suit qu'en terminale.",
    "comment": "Une option rapporte 2 coefficients par année où elle est suivie.",
    "order": 15,
    "sources": ["s-calcul-note", "s-controle-continu"]
  },
  {
    "id": "co-option-musique",
    "label": "Option musique",
    "bloc": "option",
    "coefficient": 2,
    "repartition": [{ "annee": "terminale", "part": 2 }],
    "domaine": "eps-arts",
    "quand": "Moyenne de terminale",
    "portee": "profil",
    "profilNote": "Ici suivie en terminale seulement : 2 coefficients. Sur les deux années, elle en vaudrait 4.",
    "order": 16,
    "sources": ["s-calcul-note", "s-controle-continu"]
  }
]
